"Reference","Left","KWIC","Right"
"doc#10","cur píosaí beaga den dinnéar ar fud na háite . </s><s> '' Fág faoi féin é , '' arsa Bridie . </s><s> '' Beidh do dhinnéar fuar . </s><s> '' </s><s> '' Ní íosfaidh sé","go","deo leis na huirlisí beaga sin . </s><s> '' </s><s> '' Dá mbeadh seans aige ar iad a chleachtadh ... Is cuma , is dóigh , an fhad is a itheann sé sa"
"doc#10","do dhuine eile . </s><s> '' Buíochas le Dia nach bhfuil cruinniú ar bith anocht agam . </s><s> '' Bhfuil mórán ar an teilifís ? </s><s> Tá an stiú seo","go","hálainn . </s><s> '' Rug Thatch ar a gloine agus thóg sí deoch go sciobtha , a béal dóite . </s><s> '' Goulash a thugann muid air sin sa mbaile . </s><s> ''"
"doc#10","ar bith anocht agam . </s><s> '' Bhfuil mórán ar an teilifís ? </s><s> Tá an stiú seo go hálainn . </s><s> '' Rug Thatch ar a gloine agus thóg sí deoch","go","sciobtha , a béal dóite . </s><s> '' Goulash a thugann muid air sin sa mbaile . </s><s> '' Labhair Bridie go ciúin . </s><s> '' Ó , tá brón orm nár aithin mé"
"doc#10","ar a gloine agus thóg sí deoch go sciobtha , a béal dóite . </s><s> '' Goulash a thugann muid air sin sa mbaile . </s><s> '' Labhair Bridie","go","ciúin . </s><s> '' Ó , tá brón orm nár aithin mé é , ach céard tá ann ar aon chaoi ach stiú na hUngáire , go díreach mar atá stiú dár gcuid"
"doc#10","sin sa mbaile . </s><s> '' Labhair Bridie go ciúin . </s><s> '' Ó , tá brón orm nár aithin mé é , ach céard tá ann ar aon chaoi ach stiú na hUngáire ,","go","díreach mar atá stiú dár gcuid féin againn anseo in Éirinn . </s><s> '' </s><s> '' Braitheann sé ar céard a chuireann tú ann . </s><s> '' </s><s> '' Bhuel , sé '' n dá"
"doc#10","sé ar céard a chuireann tú ann . </s><s> '' </s><s> '' Bhuel , sé '' n dá mhar a chéile domsa iad . </s><s> Níl mé in ann ubh a bhruith . </s><s> Is breá an rud é","go","bhfuair mé cócaire maith . </s><s> '' </s><s> '' B'' fhéidir nach mbeidh sí i bhfad agat . </s><s> '' Is beag nach raibh díoscán le fiacla Bhridie . </s><s> '' Ná"
"doc#10","mé cócaire maith . </s><s> '' </s><s> '' B'' fhéidir nach mbeidh sí i bhfad agat . </s><s> '' Is beag nach raibh díoscán le fiacla Bhridie . </s><s> '' Ná habair","go","bhfuil tú ag caint ar imeacht uaim arís . </s><s> '' </s><s> '' Caithfidh mé cuimhneamh ar mo shaol féin . </s><s> '' </s><s> '' Nach bhfuil tú ceart go leor anseo"
"doc#10","<s> '' Ná habair go bhfuil tú ag caint ar imeacht uaim arís . </s><s> '' </s><s> '' Caithfidh mé cuimhneamh ar mo shaol féin . </s><s> '' </s><s> '' Nach bhfuil tú ceart","go","leor anseo , agus Caomhán breá sásta ? </s><s> '' </s><s> '' Tá níos mó i saol an duine ná a bheith ag tabhairt aire do pháiste . </s><s> Ní bhíonn siad"
"doc#10","bun os cionn . </s><s> '' Bheinn caillte dá uireasa . </s><s> '' </s><s> '' Nach féidir leat ceannín beag a bheith agat féin ? </s><s> '' a dúirt Bridie","go","haerach . </s><s> '' Cén chaoi ? </s><s> Giniúint gan smál eile ? </s><s> '' </s><s> '' Ní thugann tú seans d'' fhear ar bith . </s><s> Tá tú mór le chuile dhuine ach ní"
"doc#10","ach ní fhanann tú sách fada le aithne cheart a chur ar aon duine . </s><s> '' Rug Bridie ar lámh Chaomháin , lena glanadh , goulash","go","huillinneacha air . </s><s> '' Tá neart éisc sa bhfarraige , '' ar sí le Therese . </s><s> '' Tá sé in am ag an seanmhaighdean seo dearmad a"
"doc#10","a níochán . </s><s> '' Ach ní bheadh tusa agam . </s><s> '' Chaith sí póg le Caomhán , '' marach gur fhág mé i mo dhiaidh é . </s><s> '' </s><s> '' Éist leis na soithí","go","fóill . </s><s> '' Thaitin an comhrá le Therese . </s><s> '' Is fearr liom fáil réidh leo , le go mbeidh mé in ann suí síos ag breathnú ar an"
"doc#10","gur fhág mé i mo dhiaidh é . </s><s> '' </s><s> '' Éist leis na soithí go fóill . </s><s> '' Thaitin an comhrá le Therese . </s><s> '' Is fearr liom fáil réidh leo , le","go","mbeidh mé in ann suí síos ag breathnú ar an teilifís nuair a bheas sé seo curtha a chodladh agam . </s><s> '' </s><s> '' Nífidh mise iad . </s><s> '' </s><s> ''"
"doc#10","a bhíonn an chaint ag éirí spéisiúil . </s><s> '' </s><s> '' Tá sí in ann éirí róspéisiúil . </s><s> Ní maith le duine ar bith ligean le rún . </s><s> '' </s><s> '' Shílfeá","go","mbeadh aithne sách maith againn ar a chéile le bheith in ann labhairt faoi rudaí go hoscailte . </s><s> '' </s><s> '' Téann rudaí áirithe"
"doc#10","duine ar bith ligean le rún . </s><s> '' </s><s> '' Shílfeá go mbeadh aithne sách maith againn ar a chéile le bheith in ann labhairt faoi rudaí","go","hoscailte . </s><s> '' </s><s> '' Téann rudaí áirithe ródhomhain ... '' Ní raibh na focla ag teacht i gceart chuig Bridie . </s><s> '' Ní gach rud atá"
"doc#10","rudaí áirithe ródhomhain ... '' Ní raibh na focla ag teacht i gceart chuig Bridie . </s><s> '' Ní gach rud atá duine sásta a inseacht ,","go","háirithe don duine a bhfuil tú ag obair di . </s><s> '' </s><s> '' Anois , a Bhridie , tá níos mó ann , tá súil agam , ná fostóir agus fostaí . </s><s> '' </s><s> ''"
"doc#10","ag obair di . </s><s> '' </s><s> '' Anois , a Bhridie , tá níos mó ann , tá súil agam , ná fostóir agus fostaí . </s><s> '' </s><s> '' Táimse ag obair agatsa le bliain","go","leith . </s><s> Ní hionann sin is cara croí . </s><s> Ní bhíonn tú anseo ach corruair ar aon chaoi , amuigh ag cruinnithe beagnach gach"
"doc#10","a chaitheann muid le chéile . </s><s> Is maith liom na Domhnachaí a théann muid siar Conamara ar spin . </s><s> Taitníonn do chuideachta","go","mór liom , agus , ar ndóigh , táim craiceáilte i ndiaidh an dóitín seo . </s><s> '' </s><s> '' Ní féidir le duine a bheith ina chara ceart agus í"
"doc#10","atá tú ag brath ar an duine eile fiú le thú a thabhairt amach ar spin , nuair nach bhfuil duine neamhspleách . </s><s> '' </s><s> '' B'' fhéidir","go","bhfuil tú ag iarraidh a bheith ró-neamhspleách , '' arsa Therese . </s><s> Níor thuig sí fós céard a bhí i gceist ag Bridie . </s><s> '' Ní"
"doc#10","agus a réiteach le cur a chodladh . </s><s> D'' fhág siad tamall ansin é ag dul thart ina chuid éadaí codlata , ag rith ó dhuine","go","duine acu , ag baint taitnimh as an aird a bhíodar a thabhairt air . </s><s> Thosaigh sé ag éirí glórach dána tar éis tamall i lár"
"doc#10","á réiteach . </s><s> Ag cuimhneamh ar John a bhí Bridie , ag déanamh iontais cén uair a bheadh sé amach as an bpríosún . </s><s> Bliain","go","leith a dúirt duine éigin léi , dá gcoinneodh sé na rialacha . </s><s> Choinneodh freisin . </s><s> Níorbh é an cineál duine é a bheadh ag"
"doc#10","<s> Choinneodh freisin . </s><s> Níorbh é an cineál duine é a bheadh ag troid agus ag achrann in áit mar sin . </s><s> Bhuailfeadh sé bean ceart","go","leor , ach naomh ó na Flaithis a bheadh ann in áit mar sin . </s><s> Thosaigh sí ag gáire nuair a dúirt Therese léi '' Níor airigh tú"
"doc#10",". </s><s> '' </s><s> '' Cé dúirt gur tír eile í an aimsir a caitheadh ? </s><s> '' </s><s> '' Ach is é athair do pháiste é . </s><s> '' </s><s> '' Tabhair athair air , '' a dúirt Bridie","go","searbhasach . </s><s> '' Céard a chiallaíonn athair ? </s><s> Gurbh é a rinne an jab ? </s><s> Tá níos mó i gceist le hathair ná sin , tá súil agam . </s><s> '' </s><s> ''"
"doc#10","iontach an rud é nár tháinig sé ariamh ag breathnú air . </s><s> '' </s><s> '' Ní raibh an deis aige . </s><s> Níor inis mé d'' aon duine thart anseo é , mar","go","bhfuil aithne mhór air sa gceantar . </s><s> I bpriosún i Londain atá sé . </s><s> '' D'' airigh Bridie go raibh sí in ann a rún a ligean le"
"doc#10","mé d'' aon duine thart anseo é , mar go bhfuil aithne mhór air sa gceantar . </s><s> I bpriosún i Londain atá sé . </s><s> '' D'' airigh Bridie","go","raibh sí in ann a rún a ligean le Therese ar deireadh , mar go raibh leac an doichill eatarthu briste acu an oíche sin . </s><s> '' An"
"doc#10","air sa gceantar . </s><s> I bpriosún i Londain atá sé . </s><s> '' D'' airigh Bridie go raibh sí in ann a rún a ligean le Therese ar deireadh , mar","go","raibh leac an doichill eatarthu briste acu an oíche sin . </s><s> '' An san IRA atá sé nó rud eicínt ? </s><s> '' </s><s> '' IRA . </s><s> I ran away . </s><s> Sin é a"
"doc#10",", ach ní raibh sí ag leanacht an scéil . </s><s> Ní raibh a fhios aici cé chomh fada is a bhí sí mar sin . </s><s> Níor thug sí faoi deara","go","raibh an caoineadh sa gcistineach stoptha go dtí gur chuala sí Bridie ag rá léi i nguth a bhí leathbhriste : '' An ólfaidh"
"doc#10","a bhí leathbhriste : '' An ólfaidh tú cupán caife ? </s><s> '' </s><s> '' An ólfaidh tusa rud éigin níos laidre ? </s><s> '' </s><s> '' Ní ólfaidh mé ach caife ,","go","raibh maith agat . </s><s> '' </s><s> '' An mhaith leat labhairt faoi ? </s><s> '' </s><s> '' Am eicínt eile , b'' fhéidir . </s><s> '' Tháinig na deora le súile Bhridie arís"
"doc#10","sa mbaile roimhe sin , am dá saol arbh fhearr léi dearmad iomlán a dhéanamh air . </s><s> D'' airigh siad araon ina gcroíthe istigh","go","raibh céim thábhachtach tógtha acu an oíche sin , méadú eicínt ar an tuiscint agus ar an meas a bhí acu ar a chéile . </s><s> ''"
"doc#10","oíche mhaith codlata uaim , '' arsa Therese , '' ach má bhíonn tú ag iarraidh labhairt air sin aon am , tá cluasa orm . </s><s> '' </s><s> ''","Go","raibh maith agat . </s><s> Oíche mhaith . </s><s> '' Chaith Bridie tamall fada ag breathnú isteach sa tine , an teilifís ag caint léi féin sa"
"doc#10",". </s><s> Oíche mhaith . </s><s> '' Chaith Bridie tamall fada ag breathnú isteach sa tine , an teilifís ag caint léi féin sa gcúinne . </s><s> Shíl sí","go","raibh John díbeartha as a hintinn aici , ach bhí sé soiléir ó imeachtaí na hoíche seo nach raibh . </s><s> Ní mórán a chuimhnigh sí"
"doc#10","as a hintinn aici , ach bhí sé soiléir ó imeachtaí na hoíche seo nach raibh . </s><s> Ní mórán a chuimhnigh sí air le fada , fios aici","go","raibh sí sábháilte uaidh an fhad is a bhí sé faoi ghlas . </s><s> Anois go raibh an chuid is mó dá théarma curtha isteach aige , bhí"
"doc#10","nach raibh . </s><s> Ní mórán a chuimhnigh sí air le fada , fios aici go raibh sí sábháilte uaidh an fhad is a bhí sé faoi ghlas . </s><s> Anois","go","raibh an chuid is mó dá théarma curtha isteach aige , bhí imní agus faitíos ag teacht uirthi . </s><s> Imní gan údar , b'' fhéidir ,"
"doc#10","sí ag breathnú air ar chor ar bith sa bpríosún . </s><s> Ní fhéadfadh sí . </s><s> Bhí a dóthain faighte aici uaidh , oíche an bhaiste","go","háirithe . </s><s> Bhí a fhios aici ón méid a bhí léite aici ó shin faoina leithéid gur dóigh gurb é Caomhán an chéad duine eile a"
"doc#10","siar ar an mbus uair sa tseachtain agus , ar ndóigh , bhí Maimeo agus Daideo craiceáilte ina dhiaidh , agus eisean an-mhór","go","deo leo . </s><s> Chuidigh tacaíocht a muintire léi , ach níor mhaith léi a bheith faoina gcosa ag an am céanna . </s><s> Ní raibh a háit féin"
"doc#10","sa chomórtas idir-bhailte . </s><s> Fear ard aclaí a bhí ann , é ar saoire óna chuid oibre i Sasana . </s><s> Bhéarfadh sé ar an liathróid","go","hard san aer agus nuair a bhíodh sé ag dul i dtreo an chúil ba dheacair é a stopadh . </s><s> Scóráil sé cúl agus trí chúilín an lá sin"
"doc#10","ar feadh na hoíche . </s><s> Shíl sí gurb é an duine ba deise ar domhan é . </s><s> Bhí beagán amhrais uirthi ina dhiaidh sin nuair a dúirt sé","go","bhfágfadh sé abhaile í . </s><s> '' Ná bíodh imní ar bith ort , '' a dúirt sé . </s><s> '' Tá comharsa bhéal dorais in éindí liom . </s><s> Tá Micilín bocht"
"doc#10","bocht beagáinín simplí ach coinneoidh sé súil orm . </s><s> Téann sé chuile áit in éindí liom nuair a bhím sa mbaile . </s><s> Is maith leis","go","bhfeicfí sa Mercedes é . </s><s> Bhí an oíche go hálainn . </s><s> Thiomáin sé síos chun na trá '' leis an ngealach a fheiceáil ag taitneamh"
"doc#10","sé súil orm . </s><s> Téann sé chuile áit in éindí liom nuair a bhím sa mbaile . </s><s> Is maith leis go bhfeicfí sa Mercedes é . </s><s> Bhí an oíche","go","hálainn . </s><s> Thiomáin sé síos chun na trá '' leis an ngealach a fheiceáil ag taitneamh ar bharr uisce , '' mar a dúirt John go"
"doc#10","go hálainn . </s><s> Thiomáin sé síos chun na trá '' leis an ngealach a fheiceáil ag taitneamh ar bharr uisce , '' mar a dúirt John","go","rómánsúil . </s><s> Shiúil siad cosnochta ar an ngaineamh . </s><s> Chuir John a lámha timpeall uirthi agus thug póg di . </s><s> Ba gheall leis na"
"doc#10","<s> Chuir John a lámha timpeall uirthi agus thug póg di . </s><s> Ba gheall leis na Flaithis é bheith dá pógadh i dtosach agus ba ghearr","go","raibh an dá theanga ag casadh ar a chéile . </s><s> Ní raibh Bridie ag iarraidh rudaí a ligean rófhada , agus shíl sí é a stopadh mar a"
"doc#10","ar bith ar John . </s><s> Bhí a lámha ag dul chuile áit uirthi . </s><s> Ní raibh radharc ar Mhicilín in áit ar bith . </s><s> Tar éis di ligean uirthi","go","raibh sí le géilleadh , d'' éirigh léi éalú uaidh , agus rith sí chun an chairr . </s><s> Isteach léi sa suíochán deiridh agus chuir"
"doc#10","suíochán deiridh agus chuir sí glas ar an dá dhoras . </s><s> '' Tá sé in am baile , '' a dúirt sí leis nuair a tháinig sé ar ais . </s><s> Shuigh sé","go","ciúin ar feadh tamaill sa suíochán tosaigh , ag caitheamh toitín . </s><s> Chuir sé an carr ag imeacht ansin agus thiomáin sé"
"doc#10","ag dul siar thar na suíocháin tosaigh in aon léim amháin . </s><s> Thug sé póg di in aghaidh a tola . </s><s> Bhí sí ag crith . </s><s> '' Tá a fhios agam","go","maith go bhfuil sé uait , '' ar sé , go bhfuil na hots agat dom . </s><s> '' In aghaidh a tola a ghéill sí , cé nár throid sí ina aghaidh . </s>"
"doc#10","thar na suíocháin tosaigh in aon léim amháin . </s><s> Thug sé póg di in aghaidh a tola . </s><s> Bhí sí ag crith . </s><s> '' Tá a fhios agam go maith","go","bhfuil sé uait , '' ar sé , go bhfuil na hots agat dom . </s><s> '' In aghaidh a tola a ghéill sí , cé nár throid sí ina aghaidh . </s><s> Shéid sé"
"doc#10","in aon léim amháin . </s><s> Thug sé póg di in aghaidh a tola . </s><s> Bhí sí ag crith . </s><s> '' Tá a fhios agam go maith go bhfuil sé uait , '' ar sé ,","go","bhfuil na hots agat dom . </s><s> '' In aghaidh a tola a ghéill sí , cé nár throid sí ina aghaidh . </s><s> Shéid sé buinneán an chairr nuair a"
"doc#10","''s my woman , '' ar sé i mBéarla , ag oscailt an dorais agus Micilín á chaitheamh amach as an gcarr aige . </s><s> '' Ná habair a leithéid","go","deo arís , '' a d'' fhógair sé ina dhiaidh . </s><s> Thug sé abhaile ansin í gan aon fhocal eile a rá . </s><s> B'' in é an chéad uair le fada ar lig"
"doc#10","leis an sruth smaointe sin leanacht ar aghaidh , ach ba dheacair cosc a chur leo . </s><s> Bhí a fhios aici nach gcodlódh sí go dtí","go","mbeadh an spól sin rite amach go deireadh . </s><s> Chodlódh sí lá arna mhárach , a gheall sí di féin , nuair a bheadh a shuan"
"doc#10","ar aghaidh , ach ba dheacair cosc a chur leo . </s><s> Bhí a fhios aici nach gcodlódh sí go dtí go mbeadh an spól sin rite amach","go","deireadh . </s><s> Chodlódh sí lá arna mhárach , a gheall sí di féin , nuair a bheadh a shuan tráthnóna ag Caomhán . </s><s> D'' éirígh sí agus"
"doc#10","arís . </s><s> Tháinig John chuig an teach an lá dár gcionn . </s><s> Domhnach a bhí ann , a hathair ina shuí ar aghaidh na teilifíse mar","go","raibh a amharc go dona . </s><s> Cluiche leathcheannais iománaíochta na hÉireann a bhí ann , Gaillimh in aghaidh Phoirt Láirge"
"doc#10","John chuig an teach an lá dár gcionn . </s><s> Domhnach a bhí ann , a hathair ina shuí ar aghaidh na teilifíse mar go raibh a amharc","go","dona . </s><s> Cluiche leathcheannais iománaíochta na hÉireann a bhí ann , Gaillimh in aghaidh Phoirt Láirge . </s><s> Shiúil John"
"doc#10","tarlú . </s><s> '' Siar leat in éindí leis , '' arsa a hathair , a raibh ardmheas aige ar pheileadóirí agus iománaithe . </s><s> '' B'' fhéidir","go","mbuafaidh an bheirt agaibh an rása fear agus bean . </s><s> '' </s><s> Bhí John thar a bheith lách an lá sin , agus de réir a chéile thosaigh"
"doc#10","ag troid leis faoi agus chuile chailín dá dhéanamh , ach gan fear chomh breá ag aoinneach acu . </s><s> Chuaigh siad ó theach ósta","go","teach ósta ar an mbealach aniar ón Dóilín , ag críochnú ag an damhsa i Halla Éinne . </s><s> Dúirt John léi an oíche sin go raibh sé i"
"doc#10","ósta go teach ósta ar an mbealach aniar ón Dóilín , ag críochnú ag an damhsa i Halla Éinne . </s><s> Dúirt John léi an oíche sin","go","raibh sé i ngrá léi , gurbh '' in é an fáth nach raibh sé in ann srian a choinneáil ar a phaisean an oíche roimhe . </s><s> Ní raibh srian"
"doc#10","fáth nach raibh sé in ann srian a choinneáil ar a phaisean an oíche roimhe . </s><s> Ní raibh srian ar cheachtar acu an oíche sin ná","go","deireadh na míosa a chaith sé sa mbaile . </s><s> Bhí craic an Lúnasa ar siúl ar fud Chonamara agus chuadar isteach oícheanta"
"doc#10","chuadar isteach oícheanta eile chuig na clubanna oíche i mBóthar na Trá . </s><s> Chaith John an t-uafás airgid . </s><s> Shíl Bridie","go","raibh sí i ngrá . </s><s> Rinne sí dearmad ar an Ardteist nuair a d'' iarr sé go Londain in éineacht leis í . </s><s> Bhí tuairim mhaith aici ag"
"doc#10","na Trá . </s><s> Chaith John an t-uafás airgid . </s><s> Shíl Bridie go raibh sí i ngrá . </s><s> Rinne sí dearmad ar an Ardteist nuair a d'' iarr sé","go","Londain in éineacht leis í . </s><s> Bhí tuairim mhaith aici ag an am go raibh sí ag iompar . </s><s> Fuair siad a gcuid páipéar ó na sagairt"
"doc#10","sí i ngrá . </s><s> Rinne sí dearmad ar an Ardteist nuair a d'' iarr sé go Londain in éineacht leis í . </s><s> Bhí tuairim mhaith aici ag an am","go","raibh sí ag iompar . </s><s> Fuair siad a gcuid páipéar ó na sagairt sula ndeachaigh siad go Londain agus phós siad i gCricklewood"
"doc#10","leis í . </s><s> Bhí tuairim mhaith aici ag an am go raibh sí ag iompar . </s><s> Fuair siad a gcuid páipéar ó na sagairt sula ndeachaigh siad","go","Londain agus phós siad i gCricklewood cúpla mí ina dhiaidh sin . </s><s> Páirtí sa gCrown a bhí mar bhainis acu . </s><s> Oíche an phósta"
"doc#10","i gCricklewood cúpla mí ina dhiaidh sin . </s><s> Páirtí sa gCrown a bhí mar bhainis acu . </s><s> Oíche an phósta agus é ólta mhaígh John","go","raibh , mar a chuir sé é '' beirt eile curtha suas an pole '' aige cheana . </s><s> '' Níor phós mé ceachtar acu , '' a dúirt sé . </s><s> '' Ní raibh aon"
"doc#10","ag obair óna seacht ar maidin agus sa teach ósta go dtí taca a haon déag san oíche . </s><s> Róchrua a d'' oibrigh sé agus shíl sé","go","raibh a chuid óil tuillte aige dá bharr . </s><s> Bhí Bridie breá sásta obair a fháil di féin , ach ní thabharfadh sé cead di '' ar"
"doc#10","a chuid óil tuillte aige dá bharr . </s><s> Bhí Bridie breá sásta obair a fháil di féin , ach ní thabharfadh sé cead di '' ar fhaitíos","go","dtarlódh tada don pháiste . </s><s> '' Ach ní chuimhneodh sé air sin nuair a bheadh sé dá bualadh sa mbolg . </s><s> Cén chaoi ar tháinig"
"doc#10","gach lá nó gach seachtain , agus bhí ar a chumas a bheith an-lách agus an-ghrámhar . </s><s> Bhuailfeadh sé uair sa mí ar a laghad í ,","go","háirithe nuair a bheadh fuisce ólta aige . </s><s> D'' áitigh sí go minic air an t-ól a thabhairt suas agus bheadh saol sona sásta"
"doc#10","agus an-ghrámhar . </s><s> Bhuailfeadh sé uair sa mí ar a laghad í , go háirithe nuair a bheadh fuisce ólta aige . </s><s> D'' áitigh sí","go","minic air an t-ól a thabhairt suas agus bheadh saol sona sásta acu . </s><s> Shíl seisean nach raibh fadhb ar bith aige leis an ól ,"
"doc#10","sé ar nós an pháiste . </s><s> Bheadh aiféala an domhain air . </s><s> Dhéanfadh sé rud ar bith di . </s><s> Gheallfadh sé nach dtarlódh a leithéid","go","deo arís . </s><s> Agus mhaitheadh sí dó é . </s><s> Ní ólfadh sé ar feadh seachtaine agus bheadh amanna an-deas acu . </s><s> Ach mhéadódh an"
"doc#10","mar a d'' fheicfeá ag baile . </s><s> Trí lá roimh an lá a raibh sí ocht mbliana déag rugadh Caomhán gan mórán stró . </s><s> Dúirt an dochtúir","go","raibh sí chomh folláin le breac . </s><s> Shíl Bridie ar feadh míosa go raibh John athraithe uilig ón nóiméad a thóg sé an páiste"
"doc#10","déag rugadh Caomhán gan mórán stró . </s><s> Dúirt an dochtúir go raibh sí chomh folláin le breac . </s><s> Shíl Bridie ar feadh míosa","go","raibh John athraithe uilig ón nóiméad a thóg sé an páiste ina lámha . </s><s> Bhí sé thar a bheith go deas léi agus thug sé cúnamh mór"
"doc#10",". </s><s> Shíl Bridie ar feadh míosa go raibh John athraithe uilig ón nóiméad a thóg sé an páiste ina lámha . </s><s> Bhí sé thar a bheith","go","deas léi agus thug sé cúnamh mór leis an bpáiste . </s><s> Ach d'' ól sé arís lá an bhaiste . </s><s> Nuair a bhí a gcairde imithe thosaigh sé ag"
"doc#10",". </s><s> Nuair nár fhreagair sí é , bhuail sé í . </s><s> Chiceáil sé amach as an seomra í , síos staighre ... </s><s> Bhí an t-ádh léi , a cheap sí ,","go","raibh sí fós san ospidéal nuair a cuireadh cúirt air . </s><s> Ní fhéadfadh sí fianaise a thabhairt ina aghaidh . </s><s> '' Is dóigh go"
"doc#10","sí , go raibh sí fós san ospidéal nuair a cuireadh cúirt air . </s><s> Ní fhéadfadh sí fianaise a thabhairt ina aghaidh . </s><s> '' Is dóigh","go","gceapann sé , '' a dúirt sí léi féin , '' gur sceith mé air . </s><s> '' </s><s> Céard a dhéanfadh sé nuair a thiocfadh sé amach ? </s><s> Díoltas ? </s><s> Nó an"
"doc#10","an lá ag taisteal ar fud na Gaeltachta ag tabhairt cuairte ar laithreáin oibre an Údaráis . </s><s> Thabharfadh héileacaptar","go","Béal Átha an Mhuirthid ar maidin í agus as sin ó thuaidh go hOiléan Thoraigh . </s><s> Dhéanfaidís tuirlingt ar an mbealach"
"doc#10","ar laithreáin oibre an Údaráis . </s><s> Thabharfadh héileacaptar go Béal Átha an Mhuirthid ar maidin í agus as sin ó thuaidh","go","hOiléan Thoraigh . </s><s> Dhéanfaidís tuirlingt ar an mbealach aduaidh in Eastát Tionsclaíochta Ghaoth Dobhair agus arís"
"doc#10","sna Cealla Beaga , áit a raibh sí le castáil le hiascairí de bhunadh Árainn na Gaillimhe a bhí sí ag iarraidh a mhealladh","go","calafort Ros a '' Mhíl , agus chun cónaithe ar na hoileáin arís . </s><s> '' B'' fhéidir gur mhaith leat dul amach le haghaidh deoch in"
"doc#10",". </s><s> Beimid sách luath ag dul amach ag a leathuair tar éis a naoi . </s><s> '' </s><s> Agus Thatch imithe chuig a cuid oibre chuimhnigh Bridie","go","raibh an ceart aici , go raibh sí féin agus Caomhán i mullach a chéile an t-am ar fad . </s><s> Chuirfeadh sí fios ar Shusan , a"
"doc#10","dul amach ag a leathuair tar éis a naoi . </s><s> '' </s><s> Agus Thatch imithe chuig a cuid oibre chuimhnigh Bridie go raibh an ceart aici ,","go","raibh sí féin agus Caomhán i mullach a chéile an t-am ar fad . </s><s> Chuirfeadh sí fios ar Shusan , a deirfiúr óg , teacht aniar ar"
"doc#10","fios ar Shusan , a deirfiúr óg , teacht aniar ar an mbus agus fanacht an oíche . </s><s> Bhí Caomhán an-mhór léi agus bheadh sé ceart","go","leor in éindí léi ar feadh cúpla uair an chloig . </s><s> Bhí sé chomh fada sin ó bhí Bridie amuigh le haghaidh na hoíche gur chaith"
"doc#10","ná faitíos uirthi siúl isteach in áit ar bith ná meascadh leis an dream is mó le rá sa tír . </s><s> Ach nach mbeadh sí féin ceart","go","leor in éindí léi sin ? </s><s> Choinneodh Thatch an chaint ag imeacht . </s><s> '' Ag imeacht as mo mheabhair atá mé . </s><s> Gháir sí léi féin"
"doc#10","sí léi féin . </s><s> Thosaigh sí ag gáire fúithi féin arís . </s><s> Céard a bhíonn daoine ag caint faoi sna pubanna ach seafóid ? </s><s> Bheadh sé","go","deas a bheith amuigh i measc na ndaoine . </s><s> Cailín sound a bhí i Thatch , cibé céard a dúirt aon duine fúithi . </s><s> Nach í féin a thit"
"doc#10","a chuirfeadh an milleán uirthi ? </s><s> Dhéanfadh sé a dhícheall . </s><s> Ba í a bhean chéile agus máthair a linbh fós í . </s><s> B'' fhéidir le Dia","go","n-éireodh leo tabhairt faoin saol le chéile arís , foghlaim ó na botúin a bhí déanta acu . </s><s> B'' fhéidir go n- oibreodh rudaí"
"doc#10","í . </s><s> B'' fhéidir le Dia go n-éireodh leo tabhairt faoin saol le chéile arís , foghlaim ó na botúin a bhí déanta acu . </s><s> B'' fhéidir","go","n- oibreodh rudaí amach dá mbeidís ar ais in Éirinn , ar ais sa mbaile . </s><s> Bhí a fhios aige go ndeachaigh Bridie agus an gasúr"
"doc#10","a bhí déanta acu . </s><s> B'' fhéidir go n- oibreodh rudaí amach dá mbeidís ar ais in Éirinn , ar ais sa mbaile . </s><s> Bhí a fhios aige","go","ndeachaigh Bridie agus an gasúr ar ais , díreach tar éis di theacht amach as an ospidéal i ndiaidh a buailte . </s><s> Bhí an méid"
"doc#10","ag sochraid a deirféar . </s><s> Ní mórán taitnimh a bhain sé as an gcuairt sin . </s><s> Bhí sí ag caoineadh ar feadh an achair , ag rá","go","mbeidís náirithe os comhair an tsaoil thiar sa mbaile , dá bhfaigheadh na comharsana amach go raibh sé san áit a raibh sé"
