"Reference","Left","KWIC","Right"
"doc#9","ná ní fhacthas aon taom mór cráifeach ag breith riamh air . </s><s> Bhí sé pósta agus beirt chlainne air agus caitheamh a chodach","go","láidir ann . </s><s> Neamhchosúil le Anderson ní raibh an tsuim chéanna aige sna hothair , cheapas , agus níor leasc leis"
"doc#9","chéanna aige sna hothair , cheapas , agus níor leasc leis leasainmneacha mar '' wogs '' agus '' micks '' a thabhairt orthu ach","go","ndearna sé é seo ar bhealach magúil spraíúil a bhain an urchóid as . </s><s> De réir mar a shleamhnaigh na laethanta thart chuir mé"
"doc#9","ar fad a bhí ann agus tháinig a bhformhór ó Éirinn agus ó na hIndiacha Thiar . </s><s> Ba bharda oscailte a bhí againne , d'' fhág sin","go","bhféadfadh na hothair teacht agus imeacht de réir a dtola . </s><s> Bhí cuid acu ag obair i monarchana chomh fada ó bhaile le"
"doc#9","acu ag obair i monarchana chomh fada ó bhaile le Watford . </s><s> Ar an gcéad urlár thíos fúinn bhí barda dúnta . </s><s> Chiallaigh sé sin","go","mbíodh na hothair faoi ghlas ar feadh ceithre huair fichead sa lá mar gur ceapadh iad a bheith ródhainséarach le hiad a"
"doc#9","Bhéarla aige nó b'' fhéidir gur ag leigean air fhéin a bhí sé . </s><s> Ní raibh sé taobh thoir de Ghaillimh riamh nó gur tháinig sé","go","Londain . </s><s> Níl fhios agam céard iad na cúiseanna a bhí aige lena sheolta a chrochadh . </s><s> Friothadh i vaigín traenach é agus"
"doc#9","chodladh : '' Lig dhom ... ná maraigh mé ... tá siad ag teacht . </s><s> '' Othar bocht a bhíodh ina chodladh lena thaobh dhúisíodh sé","go","tobann agus bhíodh sé ina raic eatarthu . </s><s> Cheap an Ciarraíoch seo - a nglaofaidh mise X air - go raibh comhcheilg ar bun"
"doc#9","lena thaobh dhúisíodh sé go tobann agus bhíodh sé ina raic eatarthu . </s><s> Cheap an Ciarraíoch seo - a nglaofaidh mise X air -","go","raibh comhcheilg ar bun lena chur ó rath , go raibh fuath agus gangaid ag daoine dó . </s><s> Ní raibh X in ann a inseacht dhuit go"
"doc#9","sé ina raic eatarthu . </s><s> Cheap an Ciarraíoch seo - a nglaofaidh mise X air - go raibh comhcheilg ar bun lena chur ó rath ,","go","raibh fuath agus gangaid ag daoine dó . </s><s> Ní raibh X in ann a inseacht dhuit go dearfa cérbh iad na daoine seo ach go raibh siad"
"doc#9","- go raibh comhcheilg ar bun lena chur ó rath , go raibh fuath agus gangaid ag daoine dó . </s><s> Ní raibh X in ann a inseacht dhuit","go","dearfa cérbh iad na daoine seo ach go raibh siad ann . </s><s> Go raibh siad ag oscailt a chuid litreacha , go raibh eolas acu ar an"
"doc#9","ó rath , go raibh fuath agus gangaid ag daoine dó . </s><s> Ní raibh X in ann a inseacht dhuit go dearfa cérbh iad na daoine seo ach","go","raibh siad ann . </s><s> Go raibh siad ag oscailt a chuid litreacha , go raibh eolas acu ar an tuairim ab fhánaí a rith trína cheann . </s>"
"doc#9","fuath agus gangaid ag daoine dó . </s><s> Ní raibh X in ann a inseacht dhuit go dearfa cérbh iad na daoine seo ach go raibh siad ann . </s><s>","Go","raibh siad ag oscailt a chuid litreacha , go raibh eolas acu ar an tuairim ab fhánaí a rith trína cheann . </s><s> Ón gcaoi a d''"
"doc#9","in ann a inseacht dhuit go dearfa cérbh iad na daoine seo ach go raibh siad ann . </s><s> Go raibh siad ag oscailt a chuid litreacha ,","go","raibh eolas acu ar an tuairim ab fhánaí a rith trína cheann . </s><s> Ón gcaoi a d'' iompair sé é féin agus ó na tuairimí a bhí aige ní"
"doc#9","tuairim ab fhánaí a rith trína cheann . </s><s> Ón gcaoi a d'' iompair sé é féin agus ó na tuairimí a bhí aige ní raibh aon dabht ann ach","go","raibh X tinn . </s><s> Ansin bhí cás Shean-Mhuiris . </s><s> Ba Cockney é Muiris a chleacht ceird na siúinéireachta sa saol mór lasmuigh . </s>"
"doc#9","a chleacht ceird na siúinéireachta sa saol mór lasmuigh . </s><s> Lá amháin tháinig Sean- Mhuiris abhaile agus fuair sé amach","go","raibh a bhean scuabthaí léi . </s><s> Thit an tóin as a shaol , ní éireodh sé as a leaba . </s><s> Seoladh isteach anseo é ar an gcúlráid . </s><s> Fear"
"doc#9","diabhalta a bhí ann a raibh croiméal liath air . </s><s> Bhí na seachtóidí slánaithe aige an uair úd ach bhí rian an tsaighdiúra","go","follasach air i gcónaí , go háirithe an chaoi a gcoinníodh sé é féin sciúrtha bearrtha agus a leaba pioctha néata . </s><s> Bhí"
"doc#9","croiméal liath air . </s><s> Bhí na seachtóidí slánaithe aige an uair úd ach bhí rian an tsaighdiúra go follasach air i gcónaí ,","go","háirithe an chaoi a gcoinníodh sé é féin sciúrtha bearrtha agus a leaba pioctha néata . </s><s> Bhí gluaiseacht an tsaighdiúra"
"doc#9","faoi freisin . </s><s> Liostáil Cantwell san arm nuair nach raibh sé ach ocht mbliana déag . </s><s> Throid sé sna cathanna móra","go","léir , Loos , An Marna agus Passchendale . </s><s> Chonaic sé Haigh uair , fear a chuir níos mó suime i mbeatha na gcapall ná i"
"doc#9","nuair a bhí cúrsaí an chogaidh sách cráite . </s><s> Ach ní sna fir a bhí suim ag Haig , dar le Cantwell , ach sna capaill . </s><s> Chonaic sé","go","raibh siad fíorthanaí agus d'' ordaigh sé do na hoifigigh na fir a chur amach le speal agus corrán ag baint fhéir agus fásra"
"doc#9","ag an am a choinneáil faoi rún agus a bhfuil Sasanaigh an-ghoilliúnach faoi fós . </s><s> Ba é tuairim Cantwell , agus creidim é ,","go","raibh na gnáthshaighdiúirí bréan den chogaíocht agus go raibh a lán acu ag smaoineamh iompú ar a gceannairí , filleadh"
"doc#9","faoi fós . </s><s> Ba é tuairim Cantwell , agus creidim é , go raibh na gnáthshaighdiúirí bréan den chogaíocht agus","go","raibh a lán acu ag smaoineamh iompú ar a gceannairí , filleadh abhaile agus poblacht Shóivéadach a thosú i Sasana . </s><s> Ní"
"doc#9","na saighdiúirí Sasanacha a chruachan sula gcuirtí amach sna trinsí iad . </s><s> Ba é an tuairim a bhí taobh thiar de seo ná","go","mbeadh an réamhthraenáil chomh crua sin gur campa saoire a bheadh sna trinsí i gcomparáid leis . </s><s> Roghnaigh siad an trá i"
"doc#9","chaith Cantwell agus a chomplacht tús 1917 ag traenáil ar na dumhcha gainimhe . </s><s> Bhí siad ag traenáil óna seacht ar maidin","go","dtína haon agus tar éis sos uaire arís tráthnóna agus gan ach cupán tae agus slis amháin aráin le fáil acu . </s><s> I rith an ama"
"doc#9","haon agus tar éis sos uaire arís tráthnóna agus gan ach cupán tae agus slis amháin aráin le fáil acu . </s><s> I rith an ama seo","go","léir tugadh íde na muc is na madraí dóibh ag na póilíní rúnda . </s><s> Bhí an saol chomh dona sin go raibh siad ag guí go seolfaí"
"doc#9","le fáil acu . </s><s> I rith an ama seo go léir tugadh íde na muc is na madraí dóibh ag na póilíní rúnda . </s><s> Bhí an saol chomh dona sin","go","raibh siad ag guí go seolfaí amach ar láthair an chatha iad mar b'' fhearr leo an bás féin ná an spídiúlacht seo . </s><s> Ba ag an"
"doc#9","an ama seo go léir tugadh íde na muc is na madraí dóibh ag na póilíní rúnda . </s><s> Bhí an saol chomh dona sin go raibh siad ag guí","go","seolfaí amach ar láthair an chatha iad mar b'' fhearr leo an bás féin ná an spídiúlacht seo . </s><s> Ba ag an bpointe sin a thosaigh"
"doc#9","gainimhe agus anois is arís thagadh an t-arm agus dhéandfaidís iarracht iad a ghasáil amach as a gcuid coinicéar ach","go","n-imídís leo go dtí ceantar eile . </s><s> Ní raibh aon dabht in intinn Cantwell ná gurbh é an mórthréigean seo ba chúis leis an"
"doc#9","i mbogach sa Fhrainc ná an brat dearg a bheith ar foluain os cionn Buckingham Palace . </s><s> Léigh mé a lán faoin tréimhse sin","go","bhfeicfinn an mbeadh aon sciorta den fhírinne sa méid a dúirt Cantwell agus feictear dom go raibh cuid mhór den cheart"
"doc#9","mé a lán faoin tréimhse sin go bhfeicfinn an mbeadh aon sciorta den fhírinne sa méid a dúirt Cantwell agus feictear dom","go","raibh cuid mhór den cheart aige . </s><s> Bhí éirí amach in Arm na Breataine i 1917 cé gur cuireadh faoi chois go tapa é . </s><s> Thraenáil"
"doc#9","agus feictear dom go raibh cuid mhór den cheart aige . </s><s> Bhí éirí amach in Arm na Breataine i 1917 cé gur cuireadh faoi chois","go","tapa é . </s><s> Thraenáil Arm Shasana ar an trá i mBoulogne in áit ar a nglaoití an Bull Ring . </s><s> Ní féidir glacadh leis gur aineolas"
"doc#9","amháin ba chúis leis an débâcle a tharla i bPasschendale . </s><s> Ainneoin gur tháinig Cantwell tríd an gcogadh d'' fhág sé a rian","go","láidir air . </s><s> Bhí sé seachantach airdeallach agus choinnigh sé ó chaidreamh daoine . </s><s> Is annamh a d'' oscail sé a bhéal cé go"
"doc#9","go láidir air . </s><s> Bhí sé seachantach airdeallach agus choinnigh sé ó chaidreamh daoine . </s><s> Is annamh a d'' oscail sé a bhéal cé","go","raibh sé sásta labhairt faoin gcogadh gan mhúisiam gan mhairg aon uair a thogair sé . </s><s> Ná ní raibh aon fhianaise ann go"
"doc#9","cé go raibh sé sásta labhairt faoin gcogadh gan mhúisiam gan mhairg aon uair a thogair sé . </s><s> Ná ní raibh aon fhianaise ann","go","mbíodh sé ag ramhaillí faoi ach oiread . </s><s> An rian ba mhó a d'' fhág an cogadh air ná an easpa iontaoibhe a bhí aige as daoine . </s><s> Ní"
"doc#9","ar an bhfear ba chróga . </s><s> Dúnmharfóir amháin a chas orm ansin . </s><s> Sasanach a bhí ann darbh ainm Davies . </s><s> Chuala mé ó Anderson","go","ndeachaigh sé amach maidin ag fiach coiníní sna Cotswolds agus nuair a d'' fhill sé abhaile chaith sé a bhean . </s><s> Fear ard"
"doc#9","a d'' fhill sé abhaile chaith sé a bhean . </s><s> Fear ard gruama tostach a bhí ann agus ón gcéad lá a leag mé súil air b'' fhacthas dom","go","raibh rud éigin follaithe ann . </s><s> Bhí sé rómhilis agus ró-umhal le go mbeadh sé dáiríre . </s><s> Lean sé thart ar fud an bharda mé ag"
"doc#9","ann agus ón gcéad lá a leag mé súil air b'' fhacthas dom go raibh rud éigin follaithe ann . </s><s> Bhí sé rómhilis agus ró-umhal le","go","mbeadh sé dáiríre . </s><s> Lean sé thart ar fud an bharda mé ag glaoch '' mister '' orm . </s><s> D'' oibrigh sé i monarcha i St. Albans i rith"
"doc#9","agus choir dhrúisiúil dá ndearna rí-theallach Shasana ó chianaimsir na staire ar bharr a ghoib aige agus bhí sé cinnte","go","raibh ciorcal áirithe i bhfíoríochtar Ifrinn curtha in áirithe dóibh . </s><s> Tar éis a chuid cráifeachta agus uile ní raibh"
"doc#9","darbh ainm Paul de Caen athnuachan uirthi nuair a bhí sí ag titim as a chéile agus tá an stíl Normannach le feiceáil","go","follasach uirthi i gcónaí . </s><s> Taobh amuigh den mhainistir tá páirc phoiblí ar fán síos i dtreo an locha . </s><s> De réir a chéile a d''"
"doc#9","tá páirc phoiblí ar fán síos i dtreo an locha . </s><s> De réir a chéile a d'' fhás tábhacht na mainistreach sa meánaois nó","go","mba leis an ab an talamh thart timpeall na mainistreach . </s><s> Ba don ab a thugadh na daoine a gcuid cíosa , rud a d'' fhág go mba"
"doc#9","nó go mba leis an ab an talamh thart timpeall na mainistreach . </s><s> Ba don ab a thugadh na daoine a gcuid cíosa , rud a d'' fhág","go","mba dhuine cumhachtach é . </s><s> Bhí Welsey féin ina ab ar St. Albans , cé gur doiligh a rá ar fhan sé sa mhainistir riamh . </s><s> Nuair a"
"doc#9","bhaile mar a raibh caiple móra feirme le feiceáil ar na bóithre . </s><s> Ba bheag a d'' athraigh an áit ó aimsir Shakespeare . </s><s> Seans","go","socróinn síos anseo go deo murach rud éigin a bhí do mo ghriogadh chun imeachta . </s><s> Bhí an saol ag éirí róshócúil . </s><s> Mar sin"
"doc#9","móra feirme le feiceáil ar na bóithre . </s><s> Ba bheag a d'' athraigh an áit ó aimsir Shakespeare . </s><s> Seans go socróinn síos anseo","go","deo murach rud éigin a bhí do mo ghriogadh chun imeachta . </s><s> Bhí an saol ag éirí róshócúil . </s><s> Mar sin tar éis na Nollag d'' fhág"
"doc#9","Winterbottom , fear Chiarraí agus fear Chonamara agus a gcairde ar fad agus thug mé m'' aghaidh ar Bhirmingham . </s><s> Ba ghearr","go","raibh breith ar m'' aiféal agam . </s><s> Caibidil a Seacht </s><s> Shroich mé Birmingham tráthnóna Sathairn agus é ag doirteadh báistí . </s>"
"doc#9",". </s><s> Ag smaoineamh siar dhom ar mo thréimhse sa gcathair sin tagann duairceas ar m'' intinn nach féidir a scaipeadh","go","ró-éasca . </s><s> Is geall le drochbhrionglóid é Birmingham . </s><s> Níl de shamhail ar an áit ach créachta ghránna nach bhfuil aon"
"doc#9","tá lár an bhaile fhéin agus na sráideanna a ghabhlaíonn uaidh ina thiomna do chaipitleachas doshrianta . </s><s> Ní hamháin","go","bhfuil foirgnimh ar nós an Bull Ring gránna agus míshlachtmhar ach táid salach . </s><s> Is baile salach é Birmingham . </s>"
"doc#9","báistí nuair nach bhfuil puth gaoithe ann luíonn smúit sna sráideanna a chuireann dath ainnis liath ar an uile rud . </s><s>","Go","fiú na daoine cheapfá go bhfuil an timpeallacht tar éis dul ina luí orthu agus an ghruaim tar éis dul go feirc in"
"doc#9","puth gaoithe ann luíonn smúit sna sráideanna a chuireann dath ainnis liath ar an uile rud . </s><s> Go fiú na daoine cheapfá","go","bhfuil an timpeallacht tar éis dul ina luí orthu agus an ghruaim tar éis dul go feirc in gcroíthe . </s><s> Is annamh a dhéanann"
"doc#9","ar an uile rud . </s><s> Go fiú na daoine cheapfá go bhfuil an timpeallacht tar éis dul ina luí orthu agus an ghruaim tar éis dul","go","feirc in gcroíthe . </s><s> Is annamh a dhéanann siad gáire . </s><s> Níos measa fós is baile brúidiúil é . </s><s> Sna ceantracha bochta ar nós"
"doc#9","is baile brúidiúil é . </s><s> Sna ceantracha bochta ar nós Solihull maireann na hÉireannaigh bhochta agus na hIar-Indiaigh","go","míshochair taobh le taobh . </s><s> Is geall le túr Bháibéil é Birmingham lena bhfuil de chiníocha ann . </s><s> Anois is arís briseann an"
"doc#9","i gcúl a chinn ar fhear eile . </s><s> Ba é seo mo chéad theagmháil leis an mbaile gránna seo agus fanfaidh a chuimhne i mo cheann","go","brách . </s><s> I ndeisceart na cathrach a fuair mé lóistín , ar bhóthar darbh ainm an Br . </s><s> Esme nach raibh rófhada ón mBr . </s>"
"doc#9","darbh ainm an Br . </s><s> Esme nach raibh rófhada ón mBr . </s><s> Stratford . </s><s> Ba theach é a raibh tarraingt ar chuid mhór Éireannach ann ,","go","háirithe muintir an tuaiscirt . </s><s> B'' as Tír Eoghain agus Dún na nGall a bhformhór a bhí ag obair sna mianaigh is sna tolláin"
"doc#9","chineál sin a oibríonn faoi aer brúite . </s><s> Ba é seo mo chéad theagmháil le hoibrithe na gcontaetha sin agus fuair mé amach","go","mba dhream uaibhreach maíteach iad . </s><s> Bhí drochmheas acu ar an ngnáthoibrí buildeála nó iad siúd a d'' oibrigh i"
"doc#9","faoin aer . </s><s> Chuir mé féin suim san obair tholláin seo ach chuir fear óg as an Óiméith darbh ainm McGrew fainic orm mar","go","raibh an obair tholláin ar fad ceangailte suas ag mafia Dhún na nGall agus nach ligfidís éinne isteach ach a muintir féin"
"doc#9","trí lá caite agam ag dul thart ar bhuildeálacha ag lorg oibre nuair a dúirt fear as Gaoth Dobhair liom , darbh ainm Éamonn ,","go","bhféadfainn shift a fháil ach seasamh taobh amuigh den Mermaid ar an mBóthar Stratford maidin ar bith , ach a bheith ann"
"doc#9","bhféadfainn shift a fháil ach seasamh taobh amuigh den Mermaid ar an mBóthar Stratford maidin ar bith , ach a bheith ann","go","luath . </s><s> Maidin lá arna mhárach bhíos ansin ag a seacht a chlog . </s><s> Níorbh fhada gur thosaigh naibhithe ag teacht ó i bhfad is i"
"doc#9","fhada gur thosaigh naibhithe ag teacht ó i bhfad is i ngearr . </s><s> Bhí siad idir shean agus óg ann agus an chuma orthu ar fad","go","raibh ragairne an deireadh seachtaine á chur díobh go mall acu . </s><s> Ba léir freisin ón dóigh a lorg siad toitíní ar a chéile go"
"doc#9","i ngearr . </s><s> Bhí siad idir shean agus óg ann agus an chuma orthu ar fad go raibh ragairne an deireadh seachtaine á chur díobh","go","mall acu . </s><s> Ba léir freisin ón dóigh a lorg siad toitíní ar a chéile go raibh a mbunáite briste . </s><s> Faoi mar a fuair mé amach go"
"doc#9","go raibh ragairne an deireadh seachtaine á chur díobh go mall acu . </s><s> Ba léir freisin ón dóigh a lorg siad toitíní ar a chéile","go","raibh a mbunáite briste . </s><s> Faoi mar a fuair mé amach go luath ba é '' nuair is crua don chailleach caithfidh sí rith '' ba chás dá"
"doc#9","go mall acu . </s><s> Ba léir freisin ón dóigh a lorg siad toitíní ar a chéile go raibh a mbunáite briste . </s><s> Faoi mar a fuair mé amach","go","luath ba é '' nuair is crua don chailleach caithfidh sí rith '' ba chás dá bhformhór . </s><s> Bhí seomraí le híoc agus mná lóistín ag"
"doc#9","isteach agus d'' fhág siad an t-urlár níos measa ná riamh . </s><s> Bhí an obair thar a bheith leadránach agus d'' imigh an t-am","go","mall . </s><s> Ag a haon déag fuair muid briseadh tae beag agus chuamar isteach i prefab fada mar a chaith na hoibrithe a dtráth bia"
"doc#9",", meisceoir ó Newcastle nach raibh tuairim dá laghad aige d'' obair bhuildeála , súil ghéar orainn . </s><s> Ba léir dhom ó thús","go","raibh faltanas ar leith aige leis na Gaeil a bhí bunaithe cuid mhaith ar an síolteagasc frith-Ghaelach a bhí á spré"
"doc#9","hÉireann . </s><s> Chaith sé tréimhse seirbhíse sa gCongó nuair a bhí an cogadh cathartha ag réabadh na tíre sin . </s><s> D'' inis sé dhom","go","raibh sé sa tír nuair a rinne treabhanna na mBalubas ionsaí ar chomplacht Éireannach agus iad amuigh ar patról oíche"
"doc#9","sheirfean agus d'' fhearg leis an gceannfort a sheol na fir óga seo amach chun a mbáis óir níor luigh sé le teoiricí míleata","go","gcuirfí saighdiúirí amach ar patról oíche trí fhoraoisí dlútha mar a raibh an buntáiste ar fad ag na treabhanna Balubas"
"doc#9","do na cónraí teacht abhaile chuig lucht hataí arda an rialtais lena gcuid eirbeall fada . </s><s> Ba léir gur ghoill sé seo","go","mór air mar d'' éirigh sé as an arm ar fad ar fhilleadh abhaile dhó . </s><s> Ba léir freisin gurbh é sin ba chúis leis an dúil mhór a bhí"
"doc#9",", i spikes agus faoin aer a rinne sé a shuan agus bhí a rian sin air . </s><s> Uaireanta thagadh taom casachta chomh láidir sin air is","go","mbíodh air a shluasaid nó cibé uirlis a bhíodh aige a chaitheamh uaidh . </s><s> Bhí aghaidh shéimh air a cheil cibé aois a bhí aige"
"doc#9","air a cheil cibé aois a bhí aige no cibé cruatan a bhí fulaingthe aige . </s><s> Gléasta sa seanéadach demin céanna a bhí sé ó Luan","go","Satharn agus ní fhaca mé riamh aon choisbheart á chaitheamh aige cé is moite de phéire wellingtons de chuid an"
"doc#9","isteach ar shaol na naibhithe . </s><s> Lá amháin agus muid ag ól tae ar bharr na n-árasán tosaíodh ag caint ar an gcogadh . </s><s> Tharla","go","raibh scéal báis saighdiúra Briotanach ar chéad leathnach den Sun agus tharraing Dave , '' Brummie '' óg a raibh srón"
"doc#9","gheancach air , ár n-aird ar an ár . </s><s> '' Fuckin '' Paddies at it agin '' . </s><s> Shot the bleeder '' rou '' he '' ead '' hey did . </s><s> '' </s><s> D'' fhéach sé","go","míchéadfach ar na Paddies go bhfeicfeadh sé cén toradh a bheadh ar a chuid cainte . </s><s> Níor chuir Athlone suim ar bith ina"
"doc#9","ar an ár . </s><s> '' Fuckin '' Paddies at it agin '' . </s><s> Shot the bleeder '' rou '' he '' ead '' hey did . </s><s> '' </s><s> D'' fhéach sé go míchéadfach ar na Paddies","go","bhfeicfeadh sé cén toradh a bheadh ar a chuid cainte . </s><s> Níor chuir Athlone suim ar bith ina chuid cainte ach é ina luí ar a"
"doc#9","agus é ag scrúdú an leathnaigh rásaíochta . </s><s> Bhí an iomarca suime ag Mac Mánais agus ag an Maolánach ina gcuid bia","go","gcuirfidís suim i gcogaíocht ar bith . </s><s> Mar bharr ar an donas chuir mé féin mo bhladar isteach sa scéal agus dúirt má bhí tú"
"doc#9","suim i gcogaíocht ar bith . </s><s> Mar bharr ar an donas chuir mé féin mo bhladar isteach sa scéal agus dúirt má bhí tú seafóideach","go","leor dul isteach san arm nar chóir aifeál a bheith ort dá gcaithfí thú . </s><s> Chuir seo Dave le bánaí ... </s><s> '' Wha '' about the Paddies"
"doc#9","ar na fir oibre taobh amuigh den Mhermaid agus iad bailithe ina scuaidríní ag iarraidh iad féin a choinneáil te . </s><s> Ba lú","go","mór anois an líon díobh a bhí ansin mar bhí a mbunáite ag maireachtáil ar árachas sóisialta agus níor tháinig siad amach"
"doc#9","ag maireachtáil ar árachas sóisialta agus níor tháinig siad amach ach do shift nó dhó ag deireadh na seachtaine le","go","mbeadh airgead óil acu . </s><s> I gcúl an leoraí a thug chun oibre muid bhailigh na fir ina scuaidríní faoi mar a bheidís ag"
"doc#9","reoite freisin agus gach saghas mí-áidh ag gabháil don inneall , rud a d'' fhág na saoir cloch , na '' Pakies '' ag grúsacht","go","casaoideach ag fanacht le moirtéal , cé nach ndearna siad mórán leis nuair a fuair siad é . </s><s> Bhíodh Walter freisin ag cur"
"doc#9","ornáideach a dhéanamh ar aghaidheanna na mballaí . </s><s> Níor ceadaíodh do na '' Pakies '' ach ballaí garbha a thógáil . </s><s> Ba mheasa","go","mór suí ar an dumper reoite ag an tráth sin den mhaidin . </s><s> Mise agus Grimbsey a bhí in éadan an mheascóra , an saighdiúir Mac"
"doc#9","saighdiúir Mac Mánais , agus an Maolánach ag lódáil brící ar an hoist do Dave agus Allen a bhí á ndíluchtáil do na lumpers","go","hard in airde ar na scafaill . </s><s> Timpeall a deich a chlog nuair a bhíodh teas inár gcorp le fuinneamh ár gcuid oibre agus gal"
"doc#9","a deich a chlog thagadh sé amach faoina chóta donkey , a hata derby agus a wellingtons móra a d'' fhéach chomh fairsing sin","go","gceapfá go rachadh sé amú iontu , é ag dul ar a bhá sa bpuiteach agus stró an domhain air ag iarraidh é féin a tharraingt as . </s>"
"doc#9","thagadh sé amach faoina chóta donkey , a hata derby agus a wellingtons móra a d'' fhéach chomh fairsing sin go gceapfá","go","rachadh sé amú iontu , é ag dul ar a bhá sa bpuiteach agus stró an domhain air ag iarraidh é féin a tharraingt as . </s><s> D''"
"doc#9","airde ar na fir ar an scafall , ar an hoist agus é ag caint leis féin . </s><s> D'' fhilleadh sé ar an oifig ansin agus ní fheicfeá dé air","go","hardtráthnóna . </s><s> Mura mbeadh gach rud de réir a shástachta thagadh Geordie , an meisceoir as Newcastle , ar an láthair . </s>"
"doc#9",", ag tabhairt amach faoi na málaí briste agus mar sin de . </s><s> Mar sin a chuaigh an obair ar aghaidh , gach éinne ag tarraingt","go","teann agus é bródúil as . </s><s> Ba mhil don chluais an bonnán ag a leathuair tar éis a deich . </s><s> Isteach sa seid a bhí go te teolaí . </s>"
"doc#9","ag tarraingt go teann agus é bródúil as . </s><s> Ba mhil don chluais an bonnán ag a leathuair tar éis a deich . </s><s> Isteach sa seid a bhí","go","te teolaí . </s><s> Muga mór tae agus ceapairí agus páipéar na maidine mar chompánach agat . </s><s> An fhuil ag fiuchadh i do chuisleacha"
"doc#9","arís , áit a raibh Grimbsey agus fíbín air idir gach casacht ag lódáil ar a dhícheall . </s><s> Mar sin a chuirfeá isteach an lá nó","go","n-imeodh an ghrian lag as an spéir . </s><s> Nó go dtiocfadh goimh an gheimhridh arís . </s><s> Nó go dtosaíodh soilse ar lasadh sna tithe"
"doc#9","air idir gach casacht ag lódáil ar a dhícheall . </s><s> Mar sin a chuirfeá isteach an lá nó go n-imeodh an ghrian lag as an spéir . </s><s> Nó","go","dtiocfadh goimh an gheimhridh arís . </s><s> Nó go dtosaíodh soilse ar lasadh sna tithe máguaird . </s><s> Nó Dave agus Allen ag feadaíl"
"doc#9",". </s><s> Mar sin a chuirfeá isteach an lá nó go n-imeodh an ghrian lag as an spéir . </s><s> Nó go dtiocfadh goimh an gheimhridh arís . </s><s> Nó","go","dtosaíodh soilse ar lasadh sna tithe máguaird . </s><s> Nó Dave agus Allen ag feadaíl ar na cailíní oifige ar a mbealach abhaile"
"doc#9","eile inár measc darbh ainm Fred a raibh nead theolaí déanta aige . </s><s> Cosúil le Walter b'' as na hIndiacha Thiar é agus ó tharla","go","raibh scil i scafaill aige bhí sé ag fáil ráta níos airde ná an gnáthnaibhí . </s><s> Toisc gurbh é a d'' oscail agus a dhún geataí an"
"doc#9","d'' oscail agus a dhún geataí an láithreáin d'' fhéach sé air fhéin mar chineál saoiste cé nach raibh an teideal sin bronnta","go","hoifigiúil air . </s><s> Bhí an ghráin air i measc na bhfear oibre mar go raibh luaidreáin ann go raibh sé ag tarraingt scéalta"
"doc#9","mar chineál saoiste cé nach raibh an teideal sin bronnta go hoifigiúil air . </s><s> Bhí an ghráin air i measc na bhfear oibre mar","go","raibh luaidreáin ann go raibh sé ag tarraingt scéalta go dtí an oifig . </s><s> Maidin amháin d'' ionsaigh sé Allen mar gur fhág sé"
"doc#9","nach raibh an teideal sin bronnta go hoifigiúil air . </s><s> Bhí an ghráin air i measc na bhfear oibre mar go raibh luaidreáin ann","go","raibh sé ag tarraingt scéalta go dtí an oifig . </s><s> Maidin amháin d'' ionsaigh sé Allen mar gur fhág sé a shluasaid amuigh gan"
"doc#9","black hole and leave it there . </s><s> '' </s><s> Sin a bhfuair sé de shásamh . </s><s> Bhí faitíos air tada a rá leis na Paddies mar bhí sé chomh dóigh","go","bhfaigheadh sé buille den tsluasaid anuas ar a chloigeann . </s><s> Taca an ama seo a stop mé ag cócaireacht dhom fhéin is ag ithe"
