"Reference","Left","KWIC","Right"
"doc#10","le teilifís cheart Gaeilge agus Gaeltachta a chur ar fáil . </s><s> Tá a fhios agaibh chomh maith go bhfuil dreamana sa tír ag cur","go","láidir i m'' aghaidh , go bhfuil páipéirí beaga brocacha ag déanamh ionsaithe pearsanta orm , amhail is go bhfuil mé ag"
"doc#10","agus Gaeltachta a chur ar fáil . </s><s> Tá a fhios agaibh chomh maith go bhfuil dreamana sa tír ag cur go láidir i m'' aghaidh ,","go","bhfuil páipéirí beaga brocacha ag déanamh ionsaithe pearsanta orm , amhail is go bhfuil mé ag iarraidh stáisiún de mo"
"doc#10","sa tír ag cur go láidir i m'' aghaidh , go bhfuil páipéirí beaga brocacha ag déanamh ionsaithe pearsanta orm , amhail is","go","bhfuil mé ag iarraidh stáisiún de mo chuid féin a bhunú . </s><s> Scaoil duine ón mbord eolas rúnda le nuachtáin . </s><s> Ní hé go bhfuil"
"doc#10","amhail is go bhfuil mé ag iarraidh stáisiún de mo chuid féin a bhunú . </s><s> Scaoil duine ón mbord eolas rúnda le nuachtáin . </s><s> Ní hé","go","bhfuil rúin againn cé is moite de leagan amach an stáisiúin nua . </s><s> Gnáthchleachtadh tionsclaíochta atá ansin , gan aon"
"doc#10","istigh a rá cén fáth nó éirí as . </s><s> Níl áit san eagraíocht seo do naimhde na Gaeilge agus na Gaeltachta . </s><s> Geallaim daoibh","go","mbeidh seirbhís cheart teilifíse ag an nGaeltacht . </s><s> Ní hionann an gheallúint seo agus geallúintí gan bhrí na"
"doc#10",", a cheap sí , ach ní raibh sí le cac a thógáil ó dhuine ar bith . </s><s> D'' fhan sí i mbeár an Óstáin go dtí am dúnta , ag dul ó ghrúpa","go","grúpa , ag caint is ag comhrá , ag baint as na fir oibre agus ag magadh fúthu . </s><s> Ag deireadh na hoíche chuimhnigh sí go raibh"
"doc#10","ó ghrúpa go grúpa , ag caint is ag comhrá , ag baint as na fir oibre agus ag magadh fúthu . </s><s> Ag deireadh na hoíche chuimhnigh sí","go","raibh níos mó ólta aici mar a bhí ceadaithe do thiománaithe . </s><s> D'' iarr sí ar Thomás Mac Gabhann í a fhágáil sa mbaile . </s>"
"doc#10","chomh dona is atá mé ag an gcócaireacht . </s><s> Tuige nach mbeadh deoch agat in éindí linn , os í an Nollaig í ? </s><s> '' </s><s> '' Ní bheidh ,","go","raibh maith agat . </s><s> Tá páiste agam a gcaithfidh mé aire a thabhairt dó ar maidin . </s><s> '' </s><s> '' Nach mbíonn sé sin le déanamh chuile"
"doc#10",". </s><s> Oíche mhaith . </s><s> '' </s><s> '' Ná bíodh aon imní ort . </s><s> '' Bhí diabhalaíocht le tabhairt faoi deara i nguth Therese . </s><s> '' Tógfaimid","go","deas réidh é . </s><s> Oíche mhaith . </s><s> Beimid ag caint amárach . </s><s> Insint na fírinne níl a fhios agam céard tá ort . </s><s> '' </s><s> '' Níl tada orm ach"
"doc#10","Caomhán ag dul siar abhaile le haghaidh na Nollag . </s><s> Bhíomar thiar ar cuairt inné agus thug siad cuireadh dúinn . </s><s> '' </s><s> '' Ceart","go","leor , '' arsa Therese , codladh fós ina súile , '' ach is é an trua é nár inis tú dom níos túisce . </s><s> Bheadh áit curtha in áirithe"
"doc#10","túisce . </s><s> Bheadh áit curtha in áirithe agam i gceann de na hóstáin sin a choinníonn daoine le linn na Nollag . </s><s> Is dóigh","go","bhfuil sé deireanach é a dhéanamh anois . </s><s> Ca '' id ó rinne tú an cinneadh seo ? </s><s> Shíl mé go raibh dinnéar na Nollag , nó an stuif"
"doc#10","daoine le linn na Nollag . </s><s> Is dóigh go bhfuil sé deireanach é a dhéanamh anois . </s><s> Ca '' id ó rinne tú an cinneadh seo ? </s><s> Shíl mé","go","raibh dinnéar na Nollag , nó an stuif lena aghaidh ceannaithe cheana agat . </s><s> '' </s><s> '' Bhí cúrsaí go maith eadrainn an t-am sin . </s><s> '' </s><s> ''"
"doc#10","tú an cinneadh seo ? </s><s> Shíl mé go raibh dinnéar na Nollag , nó an stuif lena aghaidh ceannaithe cheana agat . </s><s> '' </s><s> '' Bhí cúrsaí","go","maith eadrainn an t-am sin . </s><s> '' </s><s> '' Agus níl níos mó ? </s><s> Bhuel , shíl mise go raibh rudaí go maith i gcónaí , go dtí gur tháinig mé"
"doc#10","lena aghaidh ceannaithe cheana agat . </s><s> '' </s><s> '' Bhí cúrsaí go maith eadrainn an t-am sin . </s><s> '' </s><s> '' Agus níl níos mó ? </s><s> Bhuel , shíl mise","go","raibh rudaí go maith i gcónaí , go dtí gur tháinig mé abhaile aréir , tusa romham agus pus mór ort . </s><s> Céard a rinne mé ort ? </s><s> '' </s><s> ''"
"doc#10","ceannaithe cheana agat . </s><s> '' </s><s> '' Bhí cúrsaí go maith eadrainn an t-am sin . </s><s> '' </s><s> '' Agus níl níos mó ? </s><s> Bhuel , shíl mise go raibh rudaí","go","maith i gcónaí , go dtí gur tháinig mé abhaile aréir , tusa romham agus pus mór ort . </s><s> Céard a rinne mé ort ? </s><s> '' </s><s> '' Bhí glas ar an"
"doc#10","raibh an doras dúnta agam in aghaidh Chaomháin . </s><s> '' Bhfuil cead agam scíth a ligean i mo theach féin ? </s><s> Bhí an doras dúnta mar","go","bhfuil mé ar mo chéad lá saoire tar éis téarma crua oibre . </s><s> Theastaigh maidin amháin codlata uaim . </s><s> '' </s><s> '' Tá a fhios ag an saol"
"doc#10","mé ar mo chéad lá saoire tar éis téarma crua oibre . </s><s> Theastaigh maidin amháin codlata uaim . </s><s> '' </s><s> '' Tá a fhios ag an saol mór","go","n-oibríonn tú go crua , '' íoróin ina guth ag Bridie . </s><s> '' Oibríonn tusa chomh crua céanna nó níos cruaithe , agus má"
"doc#10","lá saoire tar éis téarma crua oibre . </s><s> Theastaigh maidin amháin codlata uaim . </s><s> '' </s><s> '' Tá a fhios ag an saol mór go n-oibríonn tú","go","crua , '' íoróin ina guth ag Bridie . </s><s> '' Oibríonn tusa chomh crua céanna nó níos cruaithe , agus má theastaíonn uait fanacht"
"doc#10","súil a choinneáil ar Chaomhán gan mórán stró a chur ort féin . </s><s> '' </s><s> '' Ní cuimhin liom an oíche . </s><s> '' </s><s> '' Shílfeá gur jealous a bhí tú","go","raibh mé le dul amach le fear . </s><s> '' </s><s> '' An rud céanna a cheap mise aréir , nuair a thiomáin fear abhaile mé , le nach mbeinn i mbaol"
"doc#10",". </s><s> '' </s><s> '' Mise , jealous mar gheall ar sin ! </s><s> '' Thosaigh siad beirt ag gáire ag an am céanna . </s><s> Chuir Caomhán a dhá lámh san aer le","go","dtógfaí suas é agus go mbeadh sé mar chuid den cheiliúradh . </s><s> Sheas an triúr acu i lár an tseomra , na lámha timpeall ar a"
"doc#10","mar gheall ar sin ! </s><s> '' Thosaigh siad beirt ag gáire ag an am céanna . </s><s> Chuir Caomhán a dhá lámh san aer le go dtógfaí suas é agus","go","mbeadh sé mar chuid den cheiliúradh . </s><s> Sheas an triúr acu i lár an tseomra , na lámha timpeall ar a chéile ag an mbeirt"
"doc#10","acu i lár an tseomra , na lámha timpeall ar a chéile ag an mbeirt daoine fásta , Caomhán eatarthu , a ordóg ina bhéal aige ,","go","breá sásta leis an saol . </s><s> '' B'' fhéidir go raibh mé sórt obann leat , an t-am sin a d'' iarr Peadar amach thú , '' a dúirt Therese . </s><s> ''"
"doc#10","ar a chéile ag an mbeirt daoine fásta , Caomhán eatarthu , a ordóg ina bhéal aige , go breá sásta leis an saol . </s><s> '' B'' fhéidir","go","raibh mé sórt obann leat , an t-am sin a d'' iarr Peadar amach thú , '' a dúirt Therese . </s><s> '' Níor mhaith liom a admháil go raibh éad"
"doc#10","fhéidir go raibh mé sórt obann leat , an t-am sin a d'' iarr Peadar amach thú , '' a dúirt Therese . </s><s> '' Níor mhaith liom a admháil","go","raibh éad orm , ach bíonn sórt faitíos orm faoi rud ar bith a bhrisfeadh suas an comhluadar beag atá againn féin . </s><s> '' D''"
"doc#10","'' in í an aois a mbíonn fir i mbarr a maitheasa . </s><s> '' </s><s> '' Is fíor duit . </s><s> Agus mná ag deireadh na dtríochadaí . </s><s> D'' fheilfeadh muid","go","maith dá chéile . </s><s> '' </s><s> '' Tá tú sách sean le ciall a bheith agat , '' arsa Bridie . </s><s> '' Taitníonn sé liomsa a bheith ag dul in aois . </s><s> '' </s><s> '' Ní"
"doc#10","ciall a bheith agat , '' arsa Bridie . </s><s> '' Taitníonn sé liomsa a bheith ag dul in aois . </s><s> '' </s><s> '' Ní raibh mé i ndáiríre nuair a dúirt mé","go","bhfuil tú sean . </s><s> '' Ní raibh Bridie ag iarraidh í a ghortú , achrann eile a bheith eatarthu . </s><s> '' Caithfidh sé go bhfuil"
"doc#10","nuair a dúirt mé go bhfuil tú sean . </s><s> '' Ní raibh Bridie ag iarraidh í a ghortú , achrann eile a bheith eatarthu . </s><s> '' Caithfidh sé","go","bhfuil cosúlacht mamó ceart orm . </s><s> Cúig bliana déag agus fiche a bheas mé ar an ochtú lá d'' Fheabhra . </s><s> '' </s><s> '' Tá go leor déanta"
"doc#10",". </s><s> '' Caithfidh sé go bhfuil cosúlacht mamó ceart orm . </s><s> Cúig bliana déag agus fiche a bheas mé ar an ochtú lá d'' Fheabhra . </s><s> '' </s><s> '' Tá","go","leor déanta agat le do shaol in achar gearr . </s><s> '' </s><s> '' D'' athróinn áit leatsa lá ar bith . </s><s> '' </s><s> '' Ba mhaith leat a bheith óg arís ? </s><s> '' </s><s> '' Níor"
"doc#10",", ag cuartú agus ag sracadh rudaí óna chéile . </s><s> Ach is í an aois is deise ar bhealach eile í . </s><s> Ta sé chomh lán sin de ghrá . </s><s> Tá sé","go","hálainn . </s><s> '' </s><s> '' Bhuel , má fhanann muid anseo , beidh sé tógtha agatsa chomh maith liomsa . </s><s> '' </s><s> '' Shíl mé gur ag imeacht a bhí sibh"
"doc#10","í . </s><s> '' Ó Mhamaí na Nollag é seo , '' a dúirt sí . </s><s> '' Beidh Deaidí na Nollag ag teacht ar ball . </s><s> '' Rug Bridie ar an gclúdach ar fhaitíos","go","stróicfeadh Caomhán í . </s><s> Seic cúig céad punt . </s><s> '' Bhfuil tú imithe as do mheabhair uilig ? </s><s> '' a d'' fhiafraigh sí de Therese . </s><s> ''"
"doc#10","chuimhnigh sí uirthi féin in am . </s><s> D'' fhág John stáisiún Euston ar an Aoine roimh Nollag . </s><s> Cé gur chríochnaigh sé an obair","go","luath , is ar éigean a bhí a dhóthain ama aige len é féin a níochán , a chulaith nua a chur air agus an traein faoi thalamh a"
"doc#10","sin , na mílte Éireannach i measc an tslua a bhí sna scuainí ag oifigí na dticéad . </s><s> Ní raibh cuma an óil ar mhórán acu , cé","go","raibh corrbhéic ag dul go haer anseo is ansiúd , '' You '' ll never go back , Pat , agus as áit éigin eile '' Up Seanamhach . </s><s> '' </s>"
"doc#10","i measc an tslua a bhí sna scuainí ag oifigí na dticéad . </s><s> Ní raibh cuma an óil ar mhórán acu , cé go raibh corrbhéic ag dul","go","haer anseo is ansiúd , '' You '' ll never go back , Pat , agus as áit éigin eile '' Up Seanamhach . </s><s> '' </s><s> Shuigh cailín álainn den chine"
"doc#10","oifigí na dticéad . </s><s> Ní raibh cuma an óil ar mhórán acu , cé go raibh corrbhéic ag dul go haer anseo is ansiúd , '' You '' ll never","go","back , Pat , agus as áit éigin eile '' Up Seanamhach . </s><s> '' </s><s> Shuigh cailín álainn den chine gorm isteach sa suíochán amach ar a"
"doc#10","as áit éigin eile '' Up Seanamhach . </s><s> '' </s><s> Shuigh cailín álainn den chine gorm isteach sa suíochán amach ar a aghaidh . </s><s> '' Shílfeá","go","mbeadh sé níos teocha san Afraic an t-am seo den bhliain , ná mar atá sé thart anseo , '' a dúirt sé léi , ag ceapadh go raibh sé"
"doc#10","<s> '' Shílfeá go mbeadh sé níos teocha san Afraic an t-am seo den bhliain , ná mar atá sé thart anseo , '' a dúirt sé léi , ag ceapadh","go","raibh sé fíorbharúil . </s><s> D'' éirigh sí agus d'' imigh sí go suíochán eile . </s><s> '' Nach goiliúnach atá an bhitch , '' ar sé leis féin , ''"
"doc#10","den bhliain , ná mar atá sé thart anseo , '' a dúirt sé léi , ag ceapadh go raibh sé fíorbharúil . </s><s> D'' éirigh sí agus d'' imigh sí","go","suíochán eile . </s><s> '' Nach goiliúnach atá an bhitch , '' ar sé leis féin , '' caithfidh sé nach bhfuil acmhainn grinn ar bith aici . </s>"
"doc#10","ar bheith ag caint leis féin mar a labhrófá le duine eile , cleachtadh príosúin , cleachtadh árasán . </s><s> Bhí cailín le cosa","go","tóin uirthi , mar a déarfadh na leaids , ag teacht aníos i lár na traenach . </s><s> '' Nach iontach mar a dtagann na mionsciortaí ar"
"doc#10","i ngéibheann é . </s><s> Ba dheacair do shúile a choinneáil ó na geága breátha a bhí le feiceáil . </s><s> B'' fhéidir le Dia nach fada","go","mbeadh sé féin dá fháil go rialta . </s><s> Bhí cosa ag Bridie chomh maith is a bhí ag bean ar bith . </s><s> B'' iontach an ride a bhí inti nuair"
"doc#10","dheacair do shúile a choinneáil ó na geága breátha a bhí le feiceáil . </s><s> B'' fhéidir le Dia nach fada go mbeadh sé féin dá fháil","go","rialta . </s><s> Bhí cosa ag Bridie chomh maith is a bhí ag bean ar bith . </s><s> B'' iontach an ride a bhí inti nuair a scaoilfeadh sí léi féin"
"doc#10","maith is a bhí ag bean ar bith . </s><s> B'' iontach an ride a bhí inti nuair a scaoilfeadh sí léi féin i gceart . </s><s> Ní bheadh sé i bhfad","go","mbeidís á dhéanamh arís . </s><s> '' Le cúnamh Dé , '' ar sé leis féin os ard i nGaeilge . </s><s> '' What ''s that , love ? </s><s> '' Bhí seanbhean suite"
"doc#10","gorm . </s><s> Dúirt John léi gur ag caint leis féin a bhí sé , '' agus ní fhéadfainn a bheith ag caint le duine níos deise . </s><s> '' Shíl sí","go","raibh a fhreagra an-bharúil . </s><s> Thaitin Éireannaigh léi , a dúirt sí . </s><s> Is minic a thug sí an turas traenach uirthi féin len"
"doc#10","in Dunkirk é . </s><s> Bhí saorthaisteal aici , agus thógfadh sí traenacha le bheith i gcuideachta na ndaoine , Éireannaigh ,","go","háirithe . </s><s> Gheobadh sí traein ar ais as Crewe nó áit eicínt . </s><s> Choinnigh sí uirthi ag caint , John ag breathnú san éadan"
"doc#10","sé caoi air féin agus ar a phósadh . </s><s> D'' éirigh an tseanbhean amach ag stáisiún eicínt suas i lár tíre . </s><s> Dúirt sé léi","go","raibh sé go deas a bheith ag caint léi , cé go raibh a síorchaint imithe isteach i gcluas amháin agus amach an chluas eile . </s>"
"doc#10","caoi air féin agus ar a phósadh . </s><s> D'' éirigh an tseanbhean amach ag stáisiún eicínt suas i lár tíre . </s><s> Dúirt sé léi go raibh sé","go","deas a bheith ag caint léi , cé go raibh a síorchaint imithe isteach i gcluas amháin agus amach an chluas eile . </s><s> Dúirt sí gur"
"doc#10","<s> D'' éirigh an tseanbhean amach ag stáisiún eicínt suas i lár tíre . </s><s> Dúirt sé léi go raibh sé go deas a bheith ag caint léi , cé","go","raibh a síorchaint imithe isteach i gcluas amháin agus amach an chluas eile . </s><s> Dúirt sí gur creidiúint dá thír dhúchais é . </s>"
"doc#10","thír dhúchais é . </s><s> '' Merry Christmas . </s><s> '' An dtiocfadh an lá a mbeadh sé chomh huaigneach sin , a d'' fhiafraigh sé ina intinn ,","go","mbeadh air dhul ar thraein nó ar bhus le bheith i gcuideachta daoine ? </s><s> '' Meas tú an mbíonn Mamaí mar sin thiar sa mbaile léi"
"doc#10","agus ag tabhairt daoine isteach i seomra taobh thiar , le ceistniú , de réir cosúlachta . </s><s> Níor stopadh é , agus cheap John","go","gcaithfeadh sé nach raibh cuma an scaibhaitéara air , cé nach raibh sé i bhfad tagtha as an bpríosún . </s><s> Bhí an bád mór"
"doc#10","bhfad tagtha as an bpríosún . </s><s> Bhí an bád mór brocach , boladh múisce inti , deacair áit suí a fháil . </s><s> Bhí líne mhór ag fanacht","go","foighdeach le tae agus ceapairí a cheannacht . </s><s> Ní fhaca sé duine ar bith a d'' aithin sé . </s><s> Chuaigh sé isteach sa mbeár ach"
"doc#10","agus bhuaigh sé lán glaice de shóinseáil . </s><s> Bhí a dhóthain céille aige í a chur ina phócaí , dá throime í Bhí a fhios aige","go","maith go n-íosfadh na meaisíní arís é . </s><s> Chuir sé air a chóta agus shiúil sé amach ar an deic . </s><s> Oíche fhuar thirim gan mórán"
"doc#10","bhuaigh sé lán glaice de shóinseáil . </s><s> Bhí a dhóthain céille aige í a chur ina phócaí , dá throime í Bhí a fhios aige go maith","go","n-íosfadh na meaisíní arís é . </s><s> Chuir sé air a chóta agus shiúil sé amach ar an deic . </s><s> Oíche fhuar thirim gan mórán gaoithe a"
"doc#10","rud é oiread daoine a bheith ina thimpeall gan deis cainte aige le duine ar bith acu . </s><s> Dá labhrófá le cailín , cheapfadh sí","go","raibh tú ag iarraidh í a phiocadh suas . </s><s> Bhí an chosúlacht ar na daoine nach raibh siad sásta labhairt ach le daoine a raibh"
"doc#10","a thug seisean dó , ar bhealach deas , ar ndóigh . </s><s> Ar mhaithe leis féin agus lena imirt a rinne sé é . </s><s> Chuir sé ar a shúile dó","go","raibh buachaill eile taobh istigh den lánchúl . </s><s> Dá scaoilfeadh sé an liathróid isteach aige sin , is lú an seans a bheadh"
"doc#10","buachaill eile taobh istigh den lánchúl . </s><s> Dá scaoilfeadh sé an liathróid isteach aige sin , is lú an seans a bheadh ann","go","sábhálfaí cúl . </s><s> '' Ach nach bhfuair mé féin cúl , a Dheaidí ? </s><s> '' </s><s> '' Fuair , agus fair play dhuit , ach dá ndéanfaí calaois ort ar an"
"doc#10","isteach , céard a bheadh agaibh ach cúilín , ar éigean , ón gcic saor ? </s><s> Ní hé an té a fhaigheann an cúl is tábhachtaí ach","go","bhfaightear é . </s><s> '' </s><s> Nach iomaí uair caite sa bpríosún ar an gcaoi sin aige ? </s><s> Le peil agus le mná is fearr a d'' oibrigh an"
"doc#10","na leaids air . </s><s> Ach ní raibh sé sin chomh maith ná baol air leis an rud féin . </s><s> Bheadh sé deacair Bridie a shárú sa leaba . </s><s> '' Táim","go","mór i ngrá léi i gcónaí , '' ar sé ina intinn . </s><s> Rinne sé gáire agus é ag breathnú amach ar shoilse loinge a bhí ag dul tharstu ,"
"doc#10","loinge a bhí ag dul tharstu , nuair a chuimhnigh sé ar Shasanach óg a bhíodh ag obair in éindí leis . </s><s> Deireadh seisean","go","gcuimhníonn fear ar chúrsaí gnéis gach ocht soicind . </s><s> Bhí cosúlacht ar an mbuachaill céanna gur gach soicind a"
"doc#10","gnéis gach ocht soicind . </s><s> Bhí cosúlacht ar an mbuachaill céanna gur gach soicind a chuimhnigh sé air , é ag déanamh gaisce","go","minic faoin wank is deireanaí a bhí aige , chomh fada is a d'' éirigh leis a phléisiúr a choinneáil roimh a phléasctha . </s><s> Bhí"
"doc#10",". </s><s> Bhí an diabhal ar na Sasanaigh sna cúrsaí sin , a cheap sé . </s><s> Ní raibh náire dá laghad orthu . </s><s> Tháinig an bád bán isteach","go","Baile Átha Cliath go moch ar maidin . </s><s> Shocraigh John ina intinn fanacht le haghaidh an chéad traein eile . </s><s> Bheadh"
"doc#10","ar na Sasanaigh sna cúrsaí sin , a cheap sé . </s><s> Ní raibh náire dá laghad orthu . </s><s> Tháinig an bád bán isteach go Baile Átha Cliath","go","moch ar maidin . </s><s> Shocraigh John ina intinn fanacht le haghaidh an chéad traein eile . </s><s> Bheadh bricfeasta ceart i dtosach"
"doc#10","suas ag an mbuidéal YR , páipéar cheart gan mná ina gcraiceann le hadharc a chur ort , nuacht agus spóirt leagtha amach","go","deas soiléir . </s><s> Bheadh a fhios agat go raibh tú sa mbaile . </s><s> Chuimhnigh sé gur cheart dó rud eicínt a cheannacht dá mháthair ,"
"doc#10","gan mná ina gcraiceann le hadharc a chur ort , nuacht agus spóirt leagtha amach go deas soiléir . </s><s> Bheadh a fhios agat","go","raibh tú sa mbaile . </s><s> Chuimhnigh sé gur cheart dó rud eicínt a cheannacht dá mháthair , agus nuair a bhí an bricfeasta ite"
"doc#10","mé ar seo thall , bheadh sé agam ar leathphraghas . </s><s> '' Ach ní fhéadfá a bheith gortach faoi Nollaig , le do mháthair","go","háirithe . </s><s> Ó tharla ann é , cheannaigh sé geansaí eile do Bhridie . </s><s> Nach aoibhinn a bheith beo i do thír féin , ag breathnú"
"doc#10","suas ar dhealbh Uí Chonaill . </s><s> Bhí meas aige air sin ó bhí sé ag foghlaim na staire ag an scoil . </s><s> Togha fir , do na Caitlicigh","go","háirid . </s><s> Bhreathnaigh sé ar dhealbh níos faide uaidh , fear agus dhá lámh sínte san aer . </s><s> Chuaigh sé chomh fada leis , James"
"doc#10","sin a bheith in aon leabhar staire . </s><s> Mhínigh fear tacsaí , a bhí díomhaoin ag deireadh na scuaine cérbh é féin , á mholadh","go","hard na spéire . </s><s> '' Is dóigh gur mar gur cineál communist é nár insíodh tada dúinn faoi , '' arsa John . </s><s> Chuaigh sé isteach ag"
"doc#10","i ngan fhios dó agus é ar an taobh istigh . </s><s> '' Faraor nach bhfuil , '' arsa duine acu , '' ach téann chuile chineál dhuine","go","Maigh Nuad , ag staidéar ar chúrsaí creidimh go mórmhór . </s><s> Ní théann an ceathrú cuid acu sna sagairt . </s><s> '' </s><s> '' Bheinn féin ann , '' a"
"doc#10",". </s><s> '' Faraor nach bhfuil , '' arsa duine acu , '' ach téann chuile chineál dhuine go Maigh Nuad , ag staidéar ar chúrsaí creidimh","go","mórmhór . </s><s> Ní théann an ceathrú cuid acu sna sagairt . </s><s> '' </s><s> '' Bheinn féin ann , '' a dúirt sé , ag magadh , '' dá mbeadh a fhios agam go"
"doc#10","go mórmhór . </s><s> Ní théann an ceathrú cuid acu sna sagairt . </s><s> '' </s><s> '' Bheinn féin ann , '' a dúirt sé , ag magadh , '' dá mbeadh a fhios agam","go","raibh bhur leithéidí ann . </s><s> '' Chuir siad chuile chineál ceiste air , an raibh cailín aige ? </s><s> An raibh sí go deas ? </s><s> An raibh siad"
"doc#10","mbeadh a fhios agam go raibh bhur leithéidí ann . </s><s> '' Chuir siad chuile chineál ceiste air , an raibh cailín aige ? </s><s> An raibh sí","go","deas ? </s><s> An raibh siad ag dul ag pósadh ? </s><s> Agus araile . </s><s> Ní raibh aon chall dó an fhírinne iomlán a inseacht dóibh , ar ndóigh ,"
"doc#10","ag dul ag pósadh ? </s><s> Agus araile . </s><s> Ní raibh aon chall dó an fhírinne iomlán a inseacht dóibh , ar ndóigh , ach chuaigh sé gar","go","maith dó . </s><s> Dúirt sé go raibh sé i ngrá le cailín , agus go raibh súil aige an chuid eile dhá shaol a chaitheamh léi . </s><s> Níor"
"doc#10","<s> Agus araile . </s><s> Ní raibh aon chall dó an fhírinne iomlán a inseacht dóibh , ar ndóigh , ach chuaigh sé gar go maith dó . </s><s> Dúirt sé","go","raibh sé i ngrá le cailín , agus go raibh súil aige an chuid eile dhá shaol a chaitheamh léi . </s><s> Níor dhúirt sé tada faoin"
"doc#10","an fhírinne iomlán a inseacht dóibh , ar ndóigh , ach chuaigh sé gar go maith dó . </s><s> Dúirt sé go raibh sé i ngrá le cailín , agus","go","raibh súil aige an chuid eile dhá shaol a chaitheamh léi . </s><s> Níor dhúirt sé tada faoin bpáiste , b'' fhéidir nach mbeadh aon"
"doc#10",", '' an fhad is atá an eaglais in ann leithéide sibhse a mhealladh isteach sna mná rialta . </s><s> '' </s><s> Sheas sé ag an bhfuinneog as sin","go","Gaillimh , ag breathnú amach ar na páirceanna breátha . </s><s> Nach iomaí duine óna thaobh tíre féin agus níos faide siar a"
"doc#10","ina gcónaí amuigh sa gcró nó thuas ar áiléir bhrocacha , sclábhaithe ar nós bhleaiceanna Mheiriceá . </s><s> Bhí an lá tagtha","go","raibh siad chomh maith as le dream ar bith . </s><s> B'' fhearr na tithe thiar ná áit ar bith in Éirinn . </s><s> '' Nach aisteach an mac é an saol"
"doc#10","Nach aisteach an mac é an saol , '' Bhí na seanráitis ag teacht ar ais de réir mar a bhí sé ag giorrú an bhóthair siar . </s><s> Is gearr","go","mbeadh sé sa mbaile dáiríre . </s><s> Nach aoibhinn don taistealaí ag seasamh amach ar ardán traenach na Gaillimhe tar éis"
"doc#10","sé istigh ariamh . </s><s> Tháinig beirt de na deirfiúracha ar cuairt níos deireanaí , ach níor fhan siad i bhfad . </s><s> Bhí a fhios acu","go","mbeadh sé tuirseach , an t- aistear céanna déanta go minic acu féin san aimsir a caitheadh . </s><s> Thabharfaidís na gasúir ar"
"doc#10","ar cuairt níos deireanaí , ach níor fhan siad i bhfad . </s><s> Bhí a fhios acu go mbeadh sé tuirseach , an t- aistear céanna déanta","go","minic acu féin san aimsir a caitheadh . </s><s> Thabharfaidís na gasúir ar cuairt an chéad lá eile . </s><s> Thairg a mháthair deoch"
"doc#10","aige , a dúirt sé , agus bhí sé ar intinn fanacht glan air ní ba mhó . </s><s> Chonaic sé an ríméad ag lonrú ina súile . </s><s> '' B'' fhéidir","go","bhfanfaidh tú sa mbaile ar fad an uair seo . </s><s> '' </s><s> '' Sin é atá ar intinn agam , a mham . </s><s> '' </s><s> '' Táimse ag éirí róshean le bheith ag dul"
"doc#10",". </s><s> '' </s><s> '' Bhfuil an obair fairsing ? </s><s> '' a d'' fhiafraigh John . </s><s> '' Tá togha mná i bhfeighil an Údaráis anois , rudaí feabhsaithe","go","mór ó tháinig sí ann . </s><s> Is aici atá Bridie ag obair . </s><s> '' </s><s> '' Ag obair san Údarás ? </s><s> '' </s><s> '' Ní hea , ach ag tabhairt aire dá teach . </s><s> '' </s><s> ''"
"doc#10","sí ann . </s><s> Is aici atá Bridie ag obair . </s><s> '' </s><s> '' Ag obair san Údarás ? </s><s> '' </s><s> '' Ní hea , ach ag tabhairt aire dá teach . </s><s> '' </s><s> '' Caithfidh sé","go","bhfuil teach mór aici . </s><s> '' </s><s> '' Oibríonn sí crua . </s><s> Luíonn sé le réasún go mbeadh sí ag iarraidh a béile a bheith réitithe di"
"doc#10","<s> '' </s><s> '' Ní hea , ach ag tabhairt aire dá teach . </s><s> '' </s><s> '' Caithfidh sé go bhfuil teach mór aici . </s><s> '' </s><s> '' Oibríonn sí crua . </s><s> Luíonn sé le réasún","go","mbeadh sí ag iarraidh a béile a bheith réitithe di tráthnóna tar éis na hoibre , cé go mbíonn sí sa teach ósta go dtí all"
